{
  "request_id": "adm_demo_001",
  "status": "confirmed",
  "subject_commitment": "0xaaaaaaaaaaaaaaaaaaaaaaaaaaaaaaaaaaaaaaaaaaaaaaaaaaaaaaaaaaaaaaaa",
  "claim_type": "ac_cred",
  "jurisdiction": "br",
  "attestation_root": "0xbbbbbbbbbbbbbbbbbbbbbbbbbbbbbbbbbbbbbbbbbbbbbbbbbbbbbbbbbbbbbbbb",
  "note_public_key": "0x1111111111111111111111111111111111111111111111111111111111111111",
  "membership_blinding": "123456789",
  "membership_leaf_hex": "0x0795d86e93aabb2983b9ae1f896a03155cc2abe60991303af80a964f33087dfa",
  "membership_leaf_dec": "3430943911091025709039044333567034968056565094593323194790479257846562717178",
  "membership_contract_id": "CBULZZIAHWL33XD5OBL2LBPYSFBYCNCOCIJITGJ74OSRRA7IZKIUBTKN",
  "target_network": "testnet",
  "operator_mode": "executed",
  "root_before": "4841392767291016445064949322328502391910968803811392220256028709549747603168",
  "root_after": "19245902434736527897415462227423823215302591791930935735232744133550686355488",
  "tx_handle": "700205eca2037ade2d1d6f6c44f00e7ccb04bf83f6705b85af95a10c79acc15b",
  "prepared_command": "stellar contract invoke --id CBULZZIAHWL33XD5OBL2LBPYSFBYCNCOCIJITGJ74OSRRA7IZKIUBTKN --source-account dpo2u-deployer --network testnet -- insert_leaf --leaf 3430943911091025709039044333567034968056565094593323194790479257846562717178",
  "executed_by": "dpo2u-deployer",
  "executed_at": "2026-06-18T20:23:34Z"
}
